{
	"$schema": "http://json-schema.org/draft-07/schema#",

	"definitions": {
		"alternate_link": {
			"type": "object",
			"properties": {
				"type": {"enum": ["alternate_link"]},
				"game-obj": {"enum": [
					"Spells", "Sources", "Skills", "Traits", "MonsterAbilities",
					"Conditions", "Languages", "Weapons", "Armor", "Shields",
					"Equipment", "Deities", "Feats", "Actions", "Monsters",
					"Heritages", "Rules", "Diseases", "Rituals", "Planes",
					"MonsterFamilies", "Domains", "Classes", "Ancestries",
					"Archetypes", "SiegeWeapons", "WeaponGroups"
				]},
				"game-id": {"type": "string"},
				"alternate_type": {"enum": ["legacy", "remastered"]},
				"aonid": {"type": "integer"}
			},
			"required": ["game-obj", "aonid"],
			"additionalProperties": false
		},
		"license": {
			"type": "object",
			"properties": {
				"name": {"type": "string"},
				"type": {"enum": ["section"]},
				"subtype": {"enum": ["license"]},
				"license": {"enum": [
					"OPEN GAME LICENSE Version 1.0a",
					"Open RPG Creative license"]},
				"text": {"type": "string"},
				"sections": {"$ref": "#/definitions/sections"}
			},
			"additionalProperties": false
		},
		"link": {
			"type": "object",
			"properties": {
				"name": {"type": "string"},
				"type": {"enum": ["link"]},
				"alt": {"type": "string"},
				"href": {"type": "string"},
				"game-obj": {"enum": [
					"Spells", "Sources", "Skills", "Traits", "MonsterAbilities",
					"Conditions", "Languages", "Weapons", "Armor", "Shields",
					"Equipment", "Deities", "Feats", "Actions", "Monsters",
					"Heritages", "Rules", "Diseases", "Rituals", "Planes",
					"MonsterFamilies", "Domains", "Classes", "Ancestries",
					"Archetypes", "SiegeWeapons", "WeaponGroups"
				]},
				"aonid": {"type": "integer"}
			},
			"required": ["name", "type", "alt"],
			"additionalProperties": false
		},
		"section": {
			"type": "object",
			"properties": {
				"name": {"type": "string"},
				"type": {"enum": ["section"]},
				"text": {"type": "string"},
				"sections": {"$ref": "#/definitions/sections"},
				"sources": {"$ref": "#/definitions/sources"},
				"subtype": {"enum": ["sidebar", "index"]},
				"sidebar_type": {"enum": [
					"treasure_and_rewards", "related_creatures", "locations",
					"additional_lore", "advice_and_rules"
				]},
				"sidebar_heading": {"type": "string"},
				"image": {"$ref": "#/definitions/image"}
			},
			"additionalProperties": false
		},
		"sections": {
			"type": "array",
			"items": {"$ref": "#/definitions/section"},
			"additionalItems": false
		},
		"source": {
			"type": "object",
			"properties": {
				"name": {"type": "string"},
				"type": {"enum": ["source"]},
				"link": {"$ref": "#/definitions/link"},
				"page": {"type": "integer"},
				"errata": {"$ref": "#/definitions/link"},
				"note": {"$ref": "#/definitions/link"}
			},
			"required": ["name", "type", "link"],
			"additionalProperties": false
		},
		"sources": {
			"type": "array",
			"items": {"$ref": "#/definitions/source"},
			"additionalItems": false
		}
	},
	"type": "object",
	"properties": {
		"name": {"type": "string"},
		"type": {"enum": ["trait"]},
		"game-id": {"type": "string"},
		"game-obj": {"enum": ["Traits"]},
		"aonid": {"type": "integer"},
		"value": {"type": "string"},
		"text": {"type": "string"},
		"classes": {
			"type": "array",
			"items": {"type": "string"},
			"additionalItems": false
		},
		"sources": {"$ref": "#/definitions/sources"},
		"sections": {"$ref": "#/definitions/sections"},
		"links": {
			"type": "array",
			"items": {"$ref": "#/definitions/link"},
			"additionalItems": false
		},
		"alternate_link": {"$ref": "#/definitions/alternate_link"},
		"schema_version": {"enum": [1.1]},
		"edition": {"enum": ["legacy", "remastered"]},
		"license": {"$ref": "#/definitions/license"}
	},
	"required": ["name", "type", "game-id", "game-obj", "sources", "license", "schema_version", "edition"],
	"additionalProperties": false
}