{
  "alternate_link": {
    "alternate_type": "legacy",
    "aonid": 1,
    "game-obj": "Traits",
    "type": "alternate_link"
  },
  "aonid": 523,
  "edition": "remastered",
  "game-id": "00eec53f8ff824a5080c3d092eecd593",
  "game-obj": "Traits",
  "license": {
    "license": "Open RPG Creative license",
    "name": "ORC Notice",
    "sections": [
      {
        "name": "Attribution",
        "sections": [
          {
            "name": "Player Core",
            "text": "***Pathfinder Player Core*** \u00a9 2023 Paizo Inc., Designed by Logan Bonner, Jason Bulmahn, Stephen Radney-MacFarland, and Mark Seifter. Authors: Alexander Augunas, Kate Baker, Logan Bonner, Jason Bulmahn, Carlos Cabrera, Calder CaDavid, James Case, Eleanor Ferron, Steven Hammond, Joan Hong, Vanessa Hoskins, James Jacobs, Jenny Jarzabski, Erik Keith, Dustin Knight, Lyz Liddell, Luis Loza, Patchen Mortimer, Dennis Muldoon, Stephen Radney-MacFarland, Mikhail Rekun, David N. Ross, Michael Sayre, Mark Seifter, Kendra Leigh Speedling, Mark Thompson, Clark Valentine, Andrew White, Landon Winkler, and Linda Zayas-Palmer",
            "type": "section"
          }
        ],
        "text": "This product is based on the following Licensed Material:",
        "type": "section"
      },
      {
        "name": "Attributing us",
        "sections": [
          {
            "name": "Pathfinder Open Reference",
            "text": "\u00a9 2023 Masterwork Tools LLC, Authors: Devon Jones, Monica Jones.",
            "type": "section"
          }
        ],
        "text": "If you use our Licensed Material in your own published works, please credit us as follows:",
        "type": "section"
      },
      {
        "name": "Reserved Material",
        "text": "Reserved Material elements in this product include, but may not be limited to: [none]",
        "type": "section"
      },
      {
        "name": "Expressly Designated Licensed Material",
        "text": "The following elements are owned by the Licensor and would otherwise constitute Reserved Material and are hereby designated as Licensed Material: [None].",
        "type": "section"
      }
    ],
    "subtype": "license",
    "text": "This product is licensed under the ORC License to be held in the Library of Congress and available online at various locations including paizo.com/orclicense, azoralaw.com/orclicense, and others. All warranties are disclaimed as set forth therein.",
    "type": "section"
  },
  "name": "Aberration",
  "schema_version": 1.1,
  "sources": [
    {
      "errata": {
        "alt": "2.0",
        "aonid": 216,
        "game-obj": "Sources",
        "name": "2.0",
        "type": "link"
      },
      "link": {
        "alt": "Player Core pg. 452",
        "aonid": 216,
        "game-obj": "Sources",
        "name": "Player Core pg. 452",
        "type": "link"
      },
      "name": "Player Core",
      "page": 452,
      "type": "source"
    }
  ],
  "text": "Aberrations are creatures from beyond the planes or corruptions of the natural order.",
  "type": "trait"
}