{
  "alternate_link": {
    "alternate_type": "legacy",
    "aonid": 95,
    "game-obj": "Traits",
    "type": "alternate_link"
  },
  "aonid": 633,
  "edition": "remastered",
  "game-id": "c80e26f9fa0dbec243b4a76aca7278df",
  "game-obj": "Traits",
  "license": {
    "license": "Open RPG Creative license",
    "name": "ORC Notice",
    "sections": [
      {
        "name": "Attribution",
        "sections": [
          {
            "name": "GM Core",
            "text": "***Pathfinder GM Core*** \u00a9 2023 Paizo Inc., Designed by Logan Bonner and Mark Seifter. Authors: Amirali Attar Olyaee, Logan Bonner, Creighton Broadhurst, Jason Bulmahn, James Case, Jesse Decker, Eleanor Ferron, Fabby Garza Marroqu\u00edn, Jaym Gates, Matthew Goetz, James Jacobs, Brian R. James, Jenny Jarzabski, Dustin Knight, Jason LeMaitre, Lyz Liddell, Luis Loza, Ron Lundeen, Stephen Radney-MacFarland, David N. Ross, Michael Sayre, Mark Seifter, Owen K.C. Stephens, Amber Stewart, Clark Valentine, Landon Winkler, and Linda Zayas-Palmer",
            "type": "section"
          }
        ],
        "text": "This product is based on the following Licensed Material:",
        "type": "section"
      },
      {
        "name": "Attributing us",
        "sections": [
          {
            "name": "Pathfinder Open Reference",
            "text": "\u00a9 2023 Masterwork Tools LLC, Authors: Devon Jones, Monica Jones.",
            "type": "section"
          }
        ],
        "text": "If you use our Licensed Material in your own published works, please credit us as follows:",
        "type": "section"
      },
      {
        "name": "Reserved Material",
        "text": "Reserved Material elements in this product include, but may not be limited to: [none]",
        "type": "section"
      },
      {
        "name": "Expressly Designated Licensed Material",
        "text": "The following elements are owned by the Licensor and would otherwise constitute Reserved Material and are hereby designated as Licensed Material: [None].",
        "type": "section"
      }
    ],
    "subtype": "license",
    "text": "This product is licensed under the ORC License to be held in the Library of Congress and available online at various locations including paizo.com/orclicense, azoralaw.com/orclicense, and others. All warranties are disclaimed as set forth therein.",
    "type": "section"
  },
  "name": "Ingested",
  "schema_version": 1.1,
  "sources": [
    {
      "errata": {
        "alt": "2.0",
        "aonid": 218,
        "game-obj": "Sources",
        "name": "2.0",
        "type": "link"
      },
      "link": {
        "alt": "GM Core pg. 248",
        "aonid": 218,
        "game-obj": "Sources",
        "name": "GM Core pg. 248",
        "type": "link"
      },
      "name": "GM Core",
      "page": 248,
      "type": "source"
    }
  ],
  "text": "An ingested poison is activated by applying it to food or drink to be consumed by a living creature, or by placing it directly into a living creature\u2019s mouth. A creature attempts a saving throw against such a poison when it consumes the poison or the food or drink treated with the poison. The onset time of ingested poisons typically ranges anywhere from 1 minute to 1 day",
  "type": "trait"
}