{
    "name": "Hefty",
    "type": "trait",
    "edition": "remastered",
    "sources": [
        {
            "type": "source",
            "name": "Treasure Vault (Remastered)",
            "link": {
                "type": "link",
                "name": "Treasure Vault (Remastered)",
                "alt": "Treasure Vault (Remastered)",
                "game-obj": "Sources",
                "aonid": 191
            },
            "page": 219,
            "errata": {
                "type": "link",
                "name": "2.0",
                "alt": "2.0",
                "game-obj": "Sources",
                "aonid": 191
            }
        }
    ],
    "aonid": 478,
    "game-obj": "Traits",
    "game-id": "790b3f0b98782431fda8f0bcc0625141",
    "text": "A hefty shield is so heavy that raising it takes more effort. Raising a Shield with the hefty trait is a two-action activity unless your Strength modifier equals or exceeds the number with the trait.",
    "links": [
        {
            "type": "link",
            "name": "Raising a Shield",
            "alt": "Raising a Shield",
            "game-obj": "Actions",
            "aonid": 98
        }
    ],
    "license": {
        "name": "ORC Notice",
        "type": "section",
        "sections": [
            {
                "name": "Attribution",
                "type": "section",
                "text": "This product is based on the following Licensed Material:",
                "sections": [
                    {
                        "name": "Treasure Vault",
                        "type": "section",
                        "text": "***Pathfinder Core Rulebook (Second Edition)*** \u00a9 2019, Paizo Inc.; Authors: Logan Bonner, Jason Bulmahn, Stephen Radney-MacFarland, and Mark Seifter.  \n ***Pathfinder Treasure Vault*** \u00a9 2023, Paizo Inc.; Authors: Michael Sayre, Mark Seifter, Kendra Leigh Speedling, Logan Bonner, Dan Cascone, Jessica Catalan, Kim Frandsen, Andrew Geels, Steven Hammond, Sen H.H.S., Joshua Kim, Dustin Knight, Luis Loza, Jacob W. Michaels, Matt Morris, Dave Nelson, Stephen Radney-McFarland, Jessica Redekop, Andrew Stoeckle, Mari Tokuda, and Andrew White."
                    }
                ]
            },
            {
                "name": "Attributing us",
                "type": "section",
                "text": "If you use our Licensed Material in your own published works, please credit us as follows:",
                "sections": [
                    {
                        "name": "Pathfinder Open Reference",
                        "type": "section",
                        "text": "\u00a9 2023 Masterwork Tools LLC, Authors: Devon Jones, Monica Jones."
                    }
                ]
            },
            {
                "name": "Reserved Material",
                "type": "section",
                "text": "Reserved Material elements in this product include, but may not be limited to: [none]"
            },
            {
                "name": "Expressly Designated Licensed Material",
                "type": "section",
                "text": "The following elements are owned by the Licensor and would otherwise constitute Reserved Material and are hereby designated as Licensed Material: [None]."
            }
        ],
        "subtype": "license",
        "license": "Open RPG Creative license",
        "text": "This product is licensed under the ORC License to be held in the Library of Congress and available online at various locations including paizo.com/orclicense, azoralaw.com/orclicense, and others. All warranties are disclaimed as set forth therein."
    },
    "schema_version": 1.1
}