{
    "name": "Munavri",
    "type": "trait",
    "alternate_link": {
        "type": "alternate_link",
        "game-obj": "Traits",
        "aonid": 358,
        "alternate_type": "legacy"
    },
    "edition": "remastered",
    "sources": [
        {
            "type": "source",
            "name": "Monster Core 2",
            "link": {
                "type": "link",
                "name": "Monster Core 2 pg. 365",
                "alt": "Monster Core 2 pg. 365",
                "game-obj": "Sources",
                "aonid": 276
            },
            "page": 365
        }
    ],
    "aonid": 880,
    "game-obj": "Traits",
    "game-id": "5cc41797f19d94efc9f71f9ff4c38c68",
    "text": "Amicable humanoids living in the Darklands, munavris have powerful telekinetic and psychic abilities.",
    "license": {
        "name": "ORC Notice",
        "type": "section",
        "sections": [
            {
                "name": "Attribution",
                "type": "section",
                "text": "This product is based on the following Licensed Material:",
                "sections": [
                    {
                        "name": "Monster Core 2",
                        "type": "section",
                        "text": "***Pathfinder Monster Core 2*** \u00a9 2025 Paizo Inc., Authors: Alexander Augunas, Jesse Benner, Joshua Birdsong, Logan Bonner, Jason Bulmahn, James Case, Jessica Catalan, John Compton, Paris Crenshaw, Adam Daigle, Katina Davis, Jesse Decker, Darrin Drader, Felix Dritz, Brian Duckwitz, Robert N. Emerson, Scott Fernandez, Eleanor Ferron, Hexe Fey, Benjamin U. Fields, Keith Garret, Scott Gladstein, Leo Glass, Matthew Goodall, Alice Grizzle, T.H. Gulliver, Sen H.H.S., Steven Hammond, Tim Hitchcock, Joan Hong, Vanessa Hoskins, James Jacobs, Brian R. James, Michelle Jones, TJ Kahn, Mikko Kallio, Jason Keeley, Joshua Kim, Avi Kool, John Laffan, Lyz Liddell, Luis Loza, Colm Lundberg, Ron Lundeen, Mahpiya, Philippe-Antoine Menard, Jacob W. Michaels, Patchen Mortimer, Dennis Muldoon, Andrew Mullen, Quinn Murphy, Dave Nelson, Jason Nelson, K. Tessa Newton, Tim Nightengale, Samantha Phelan, Randy Price, Stephen Radney-MacFarland, BJ Recio, Jessica Redekop, Mikhail Rekun, Patrick Renie, Alex Riggs, David N. Ross, Simone D. Sall\u00e9, Michael Sayre, David Schwartz, Mark Seifter, Chris S. Sims, Rodney Sloan, Shay Snow, Kendra Leigh Speedling, Amber Stewart, Jeffrey Swank, Tan Shao Han, Russ Taylor, William Thompson, Jason Tondro, Clark Valentine, Ruvaid Virk, Andrew White, Landon Winkler, and Linda Zayas-Palmer"
                    }
                ]
            },
            {
                "name": "Attributing us",
                "type": "section",
                "text": "If you use our Licensed Material in your own published works, please credit us as follows:",
                "sections": [
                    {
                        "name": "Pathfinder Open Reference",
                        "type": "section",
                        "text": "\u00a9 2023 Masterwork Tools LLC, Authors: Devon Jones, Monica Jones."
                    }
                ]
            },
            {
                "name": "Reserved Material",
                "type": "section",
                "text": "Reserved Material elements in this product include, but may not be limited to: [none]"
            },
            {
                "name": "Expressly Designated Licensed Material",
                "type": "section",
                "text": "The following elements are owned by the Licensor and would otherwise constitute Reserved Material and are hereby designated as Licensed Material: [None]."
            }
        ],
        "subtype": "license",
        "license": "Open RPG Creative license",
        "text": "This product is licensed under the ORC License to be held in the Library of Congress and available online at various locations including paizo.com/orclicense, azoralaw.com/orclicense, and others. All warranties are disclaimed as set forth therein."
    },
    "schema_version": 1.1
}