{
  "alternate_link": {
    "alternate_type": "legacy",
    "aonid": 93,
    "game-obj": "Traits",
    "type": "alternate_link"
  },
  "aonid": 631,
  "edition": "remastered",
  "game-id": "b26076555c07646f046dd58e7d5b3885",
  "game-obj": "Traits",
  "license": {
    "license": "Open RPG Creative license",
    "name": "ORC Notice",
    "sections": [
      {
        "name": "Attribution",
        "sections": [
          {
            "name": "Player Core",
            "text": "***Pathfinder Player Core*** \u00a9 2023 Paizo Inc., Designed by Logan Bonner, Jason Bulmahn, Stephen Radney-MacFarland, and Mark Seifter. Authors: Alexander Augunas, Kate Baker, Logan Bonner, Jason Bulmahn, Carlos Cabrera, Calder CaDavid, James Case, Eleanor Ferron, Steven Hammond, Joan Hong, Vanessa Hoskins, James Jacobs, Jenny Jarzabski, Erik Keith, Dustin Knight, Lyz Liddell, Luis Loza, Patchen Mortimer, Dennis Muldoon, Stephen Radney-MacFarland, Mikhail Rekun, David N. Ross, Michael Sayre, Mark Seifter, Kendra Leigh Speedling, Mark Thompson, Clark Valentine, Andrew White, Landon Winkler, and Linda Zayas-Palmer",
            "type": "section"
          }
        ],
        "text": "This product is based on the following Licensed Material:",
        "type": "section"
      },
      {
        "name": "Attributing us",
        "sections": [
          {
            "name": "Pathfinder Open Reference",
            "text": "\u00a9 2023 Masterwork Tools LLC, Authors: Devon Jones, Monica Jones.",
            "type": "section"
          }
        ],
        "text": "If you use our Licensed Material in your own published works, please credit us as follows:",
        "type": "section"
      },
      {
        "name": "Reserved Material",
        "text": "Reserved Material elements in this product include, but may not be limited to: [none]",
        "type": "section"
      },
      {
        "name": "Expressly Designated Licensed Material",
        "text": "The following elements are owned by the Licensor and would otherwise constitute Reserved Material and are hereby designated as Licensed Material: [None].",
        "type": "section"
      }
    ],
    "subtype": "license",
    "text": "This product is licensed under the ORC License to be held in the Library of Congress and available online at various locations including paizo.com/orclicense, azoralaw.com/orclicense, and others. All warranties are disclaimed as set forth therein.",
    "type": "section"
  },
  "name": "Incapacitation",
  "schema_version": 1.1,
  "sources": [
    {
      "errata": {
        "alt": "2.0",
        "aonid": 216,
        "game-obj": "Sources",
        "name": "2.0",
        "type": "link"
      },
      "link": {
        "alt": "Player Core pg. 457",
        "aonid": 216,
        "game-obj": "Sources",
        "name": "Player Core pg. 457",
        "type": "link"
      },
      "name": "Player Core",
      "page": 457,
      "type": "source"
    }
  ],
  "text": "An ability with this trait can take a character completely out of the fight or even kill them, and it\u2019s harder to use on a more powerful character. If a spell has the incapacitation trait, any creature of more than twice the spell\u2019s rank treats the result of their check to prevent being incapacitated by the spell as one degree of success better, or the result of any check the spellcaster made to incapacitate them as one degree of success worse. If any other effect has the incapacitation trait, a creature of higher level than the item, creature, or hazard generating the effect gains the same benefits.",
  "type": "trait"
}